{
  "kind": "legacyEstimatedHistory",
  "version": 1,
  "historyId": "00000000-0000-4000-8000-000000000301",
  "historyEntryId": "00000000-0000-4000-8000-000000000302",
  "sourceRevision": "1",
  "operation": "upsert",
  "legacySourceKind": "dose_log",
  "legacySourceId": "00000000-0000-4000-8000-000000000106",
  "pillId": "00000000-0000-4000-8000-000000000104",
  "scheduleId": "00000000-0000-4000-8000-000000000105",
  "localDateEvidence": null,
  "localTimeEvidence": null,
  "storedUtc": "2026-09-24T05:01:00.000Z",
  "timeZoneStatus": "legacy_unknown",
  "provenance": "legacy_estimated",
  "state": "taken",
  "historicalInventoryDeltaEvidence": null,
  "inventoryDeltaProvenance": "unknown",
  "migrationInventoryEffect": "none",
  "inventoryDisposition": "effect_unknown",
  "sourceFingerprint": "aaaaaaaaaaaaaaaaaaaaaaaaaaaaaaaaaaaaaaaaaaaaaaaaaaaaaaaaaaaaaaaa",
  "entityRevision": "1"
}
